{
  "schema_version": "1",
  "project_id": "PRJ-EXAMPLE-001",
  "name": "Example Project",
  "description": "Replace with a short project description.",
  "owner": "owner-name",
  "domains": ["software"],
  "criticality": "medium",
  "lifecycle_state": "DRAFT",
  "blocked": false,
  "version": "0.1.0",
  "created_at": "1970-01-01T00:00:00Z",
  "updated_at": "1970-01-01T00:00:00Z",
  "master_system_version": "0.1.0",
  "source": "se init",
  "metadata": {}
}
